"নিউজের লাস্টের লাইন টা দেখলেই বোঝা যায়, এরদোগানের"
মসজিদ নির্মাণে বিবিসির জ্বলে।
তোমাদের জ্বলা নিভা দিয়ে মসজিদ ওপেন অন হবে না।… See more
পুরনো তথাকথিত একটি বিক্ষোভকে 'তুমুল বিক্ষোভ' হিসেবে উপস্থাপন করার মাধ্যমে বিবিসিও তুমুল বিতর্কের জন্ম দিয়েছে৷
এরদোয়ানকে আন্তরিক ধন্যবাদ জানাচ্ছি। তুর্কি মুসলিমদের জন্য দোয়া ও ভালবাসা রইলো।
বিবিসি মানেই বিনোদন।
যে সকল মুসলিম দেশের সাধারণ জনগন বা সরকার প্রধানরা মুসলমান হয়েও শয়তানের এজেন্ডা বাস্তবায়নে কাজ করে তাদের হাত থেকে সাধারণ ধর্মপ্রান মুসলিমদের রক্ষার জন্য আল্লাহর পক্ষ থেকে দুনিয়াতেই তাদের বিচার হওয়ার দরকার ছিল।
বাংলাদেশের শাহবাগ চত্বরেও একটি মসজিদ নির্মাণ করা জরুরি। এদিকে মসজিদ কম থাকায় নামাজ পড়তে অসুবিধা হয়ে। রমনা - সোহরাওয়ার্দী ও জাদুঘরে ঘুরতে আসা লোকদের নামাজের জায়গা পর্যন্ত নেই। প্রধানমন্ত্রীর ৪০০ মসজিদ করার চাইতে এটি করা খুবই জরুরি।
"বাংলাদেশ সরকার ভুলে গেছেন ওমান বলতে একটা দেশ আছে, সেখানে ৭-৮ লাখ প্রবাসী কাজ করেন, আজ কতদিন হল সেখানে কোনরকম বিমান যোগাযোগ নাই, কোন বিশেষ ফ্লালাইট ও পরিচালিত হচ্ছে না। এটা তথাকথিত সরকারের অদুরদরশিতার ফল। অনতিবিলম্বে ওমান থেকে দেশে ফেরার ইমারজেন্সি ফ্ল… See more"
মসজিদ নির্মাণের বিরোধিতায়
ব্যাপক বিক্ষোভ হয়েছিল তাতে যত লোক অংশ নিয়েছিল তার চাইতে এখন কত % বেশি মানুষ খুশি হয়েছে তা উল্লেখ করলে ভালো হতো
"তোমাদের জ্বালা,যন্ত্রণা যতই বাড়বে"
সুলতান ততই এগিয়ে যাবে।
তাকসিম স্কয়ারের গাজি পার্কে ২০১৩ সালে যখন এই মসজিদ নির্মাণের উদ্যোগ নেয়া হয়েছিলো তখন সেখানে এর প্রতিবাদে ব্যাপক বিক্ষোভ হয়েছিলো।
এমনকি বিশ্বের নানা জায়গায় ওই বিক্ষোভের প্রতি সংহতি জানিয়েও নানা কর্মসূচি পালিত হয়েছিলো।… See more
ভালো কার্য!এরদোয়ান চালাক প্রকৃতি লোক ক্ষমতা থাকার জন্য ধর্মকে শক্তভাবে ব্যবহার করতে জানে সে!এরা আসলেই এক মহা ধর্ম ব্যবসায়ী।
"বিবিসি সবসময় উস্কানি মুলক ও ইসলাম বিরুধী কথা বলে,,,"
এই মসজিদ নির্মাণের সময় মসজিদের পক্ষে/ স্বাগত জানিয়ে যে মিছিল হলো সেটাতো বললেন না!!!
"রাম রাম সেকুলার,"
মসজিদ নির্মাণ হবে সেখানেও আবার তার বিরুদ্ধে বিক্ষোভ।
আল্লাহ তাদেরকে হেদায়েত দান করুন।
২০১৯ সালে ইস্তাম্বুল যাওয়ার সুযোগ হয়েছিল। তাকসিম স্কোয়ারের পাশেই হোটেল হওয়াতে প্রতিদিন সাকসিম স্কোয়ারে যেতাম। স্কোয়ারের একপাশে একটা মসজিদ নির্মানাধীন ছিল। আমাদের গাইড ছিল একজন খৃষ্টান। সেও কখনো বলেনি এই মসজিদ তৈরীর আগে এখানে বিক্ষোভ হয়েছে। মসজিদ… See more
ধন্যবাদ। সাহসী নেতা এরদোয়ান কে। গুটিকয়েক কামাল আতাতুর্কের চেলা চামুণ্ডার বিরোধীতার থুরাই তোয়াক্কা না করে তাকসিম স্কয়ার কে বেহায়াপনা উলঙ্গপনা থেকে রক্ষা করার জন্য মসজিদের মতো পবিত্র ঘর নির্মাণ করার জন্য।
"ভেঙে যাবে হাড়,"
"তাও ভাঙবে না ফার্নিচার,"
"এ যে মারাত্বক হাতিয়ার দামে কম মানে ভালো কাকলি ফার্নিচার
… See more"
"আপনাদের কি বুকে ব্যাথা করে বিবিসি? ধর্মনিরপেক্ষতা ভালো জিনিস, তবে সংবাদ নিরপেক্ষতা না থাকা ভন্ডামি।"
"এইতো বিবিসির চুলকানো শুরু হয়ে গেছে, মসজিদ কেন এরদোগান নির্মাণ করল"
"আমি কামাল আতাতুর্কের সেকুলারিজম দেখি নাই।তবে আমি দেখেছি একটি সেকুলারিজম রাষ্ট্রকে কিভাবে সুলতান এরদোয়ান আস্তে আস্তে মুলধারার ইসলামি রাষ্ট্রে পরিনত করেছেন।এ জন্য সুলতান এরদোয়ানকে অনেক খড় কাঠ পোড়াতে হয়েছে। এগিয়ে যাক তুরস্ক। কেননা, তুরস্ক এগিয়ে গেলে পুরো … See more"
"তুরষ্ক থেকে ইসলামকে বিতাড়িত করতে চেয়ে ছিল এই সেকুলার নামক নর্দমার কিটগুলো, আবার ফিরে আসছে ইসলাম তুরস্কে। জ্বলতে থাকুক কিট গুলো কারণ ওদের স্থানতো নর্দমায়।"
একটা সেকুলার রাষ্ট্রকে কিভাবে ধীরে ধীরে ইসলামি রাষ্টে পরিণত করতে হয় তার জ্বলন্ত উদাহরণ তুরস্কের এরদোয়ান।
"যে দেশে শত বছর ধরে প্রকাশ্যে নামাজ ও ধর্মীয় শিক্ষার্জন নিষিদ্ধ ছিলো, সেই দেশ আজ ইসলামিক রাষ্ট্রের বড় উদাহরণ হতে যাচ্ছে।… See more"
যারা ইসলামবিদ্বেষী তারাই মসজিদ নির্মাণের বিরোধিতা করে।
"বিবিসির শিরোনাম, নিউজের ভাষ্য থেকে বুঝা যায়, বিবিসিও বিরোধীর সাথে।"
এরদোয়ানতো বিশ্বের সেরা এক মৌলবাদী এটাতো আমরা সবাই ই জানি। তার কাজ ই মসজিদ তৈরী করা। জাদুঘর বা আধুনিক কোন স্থাপনাতো এদের থেকে আশা করা যায় না
"""কিন্তু প্রতিবাদকারীরা সবশেষে মিস্টার এরদোয়ানের কর্তৃত্বপরায়নতাকেই আরও বিস্তৃত হতে দেখলো"""
"বিবিসির প্রচুর জ্বালা, যন্ত্রনা করতেছে।"
সময় বদলেছে।এই মসজিদ উদ্বোধন করতে পারার মানে হচ্ছে তুরস্ক এখন ১০০ বছর পেছন থেকে আবার তাদের পথ চলা শুরু করছে।
"মসজিদ মুমীনদের জন্য জান্নাত হলেও নাস্তিকদের জন্য কলিজার ক্ষত। তারা কিছুতেই চায় না, পৃথিবীতে একটা মসজিদ নির্মাণ হোক। তাদেরর সুখ পতিতালয় প্রতিষ্টায়। তাই বিবিসির বদমাশরা সহ যাদের গা জ্বালা করছে, তাদের দেখে অবাক হতে নেই। আবু জেহেলদের আত্মারা বেঁচে থাকবে কি… See more"
এরদোয়ান তার দেশে মসজিদ উদ্বোধন করেন আর বিবিসির সাংবাদিকের চুলকানো রোগ বাড়ে।
"বিবিসির খুব কষ্ট হচ্ছে,আচ্ছা সারা দুনিয়ায় যখন বিপ ইনস্টলের হিড়িক পড়লো তখন তুমরা বিপ নিয়ে নিউজ করলে না আর এখন একটা ভালো সংবাদ কে রং মাখিয়ে নেগেটিভলি পরিবেশন করছো কেন।"
একেই বলে ইসলাম বিদ্বেষী মিডিয়া।হাজার হাজার লোক সমাগম হলো।মুসল্লী রা নামাজ পড়ার জায়গা পেলো না।আর ওরা হেডলাইনে আট বছর আগের গুটিকয়েক নাস্তিকের কার্যক্রম কে ব্যাপক বিক্ষোভ বানিয়ে দিলেন।
বিবিসির ইসলামিক বিষয় একটু বেশি চুলকানি চুলকানি থাকার কথাই কারণ এর গোড়াতে দোষ।
"আগে ওখানে কি ফাঁকা জায়গা ছিল, না কোনো স্থাপনা ভেঙে তৈরি হল? ভারতে একটা স্থাপনা ভেঙে মন্দির হল। বিশ্বের কাউকে কিছু বলতে দেখিনি।"
তুরস্ক পশ্চিমাদের আদলে সম্পর্ন একটি সেকুলার স্টেট। এদের লাইফ স্টাইল একজন মুসলিম হিসেবে মনে হয় না যতক্ষণ না বলে আমি মুসলিম। ইসলামকে আদর্শ হিসেবে গ্রহন করে নি। মাসজিদের বিলাসিতা দিয়ে ইসলামের জাগরন হয় না। জাগরন তখন হবে যখন তুর্কি জাতীয়তাবাদ সেকুলারিজমের ত… See more
মসজিদ নির্মাণের বিরোধিতা কিন্তু কি কারণে হলো তা তো নাই রিপোর্টে
অথচ এরকম ১ লক্ষ মসজিদের বিনিময়ে আল আকসা ইহুদীমুক্ত হলেও মুসলমানদের আপত্তি থাকবে না।
আল আকসার জন্য হাজারো মানুষের জীবন গেলেও বিশ্ব মোড়লদের কর্ণপাত নেই।
আর এতে বি বিচির ফেটে যাচ্ছে
তারমানে সেখানে আবু জাহেলদের সংখ্যাও কম নয়!
এই ভাবেই একদিন মুসলমানদের গৌরবময় ইতিহাস ফিরে আসবে ইনশাআল্লাহ।
This is BBC....always try push negative sensitivity ...and try to spread romour about turkey....
"এরদোগানের প্রতি ভালোবাসা
রইলো বাংলাদেশের জনগনের পক্ষ থেকে।"
আগামীর বিশ্ব মুসলমানদের নেতৃত্বে পরিচালিত হবে ইনশাআল্লাহ
ধন্যবাদ মিস্টার এরদোয়ান
এরদোয়ান এর গুড জব শুভকামনা করছি
বৃটিশ দালালদের অনেক কষ্ট হচ্ছে বুঝি।
বিবিসির জলন শুরু হয়ে গেছে
ফিরে আসুক সর্ণ যুগ অটোমেনর সুলতান সুলেমানের শাসন ।
আলহামদুলিল্লাহ। মুসলমানদের গৌরবময় দিনগুলো ফিরে আসুক এরদোয়ানের নেতৃত্বে।
নিউজের লাস্ট প্যারাতে বিবিসি তাদের ইসলাম বিদ্বেষী মনোভাবের প্রকাশ ঘটালো।
"বাংলাদেশে ও কামাল আতার্তুক প্রেতাত্বরা ঘুরে বেড়াছে,সেকুলার এসব ধর্ম বিদ্বেষীথেকে পবিত্র ইসলাম ধর্মকে হেফাজত করার মালিক তুমি আল্লাহ, তুমি মুসলমানদের জানমাল হেফাজত করো,আমিন।"
কামাল্যায়ার নাম নিতে খুব মজা লাগের?!
মসজিদ মাদ্রাসা নিয়ে যত পেট ব্যথা মুরতাদদের
তুর্কী তে খুব সুন্দর একটা জায়গা। একবার ভ্রমন এ গিয়েছি।
ধর্মকে খুব ভাল ভাবে ব্যবহার করতে জানে এদোয়ান ।
৮ বছর আগের বিরুদ্ধীতার সংবাদ শিরোনাম না দিয়ে বর্তমান মসজিদ নির্মাণের গণজনপ্রিয়তা প্রচার করুন।
সাম্প্রদায়িক বিবিসি বাংলার প্রতিবেদন। এর চেয়ে বেশি আর কি আশা করা যায়
ইসরায়েলে ভারতের মানুষ কামলা করার সুযোগ পাইছে।এ কৃতজ্ঞতা বোধ থেকে তারা ইসরায়েলের পক্ষে হ্যাশ ট্যাগ দিচ্ছে।
একদল শয়তানের শরীরে আগুন শুরু
Muslim der aasha aakhankar protik...jonab resep tayep Erdogan
কি সুন্দর ভাগ করা হয়েছে!!!! অন্য দেশের থেকে লোক এনে আমার জায়গায় ঘর করে আমাকে বলছে জমি সমান ভাগ করে দিলাম মেনে নাও। বাহ্ কি চমৎকার বিচার ব্যবস্থা!!!
"সারা বিশ্ব জুড়ে শাসনের আকাংখা ছিল বৃটেনের চলছে অনেক দিন এরপর আমেরিকা, অস্ট্রেলিয়া, এশিয়া থেকে বিতা… See more"
ধর্ম নিরপেক্ষতা/মানবাধিকার ব্যাবসা শুধু মুসলিম দেশ গুলোর ক্ষেত্রে কেন??
এটা শুনার পর কিছু মানুষের চুলকানি শুরু হয়ে যাবে
শয়তানগুলা খুব জ্বলা জ্বলছে দেখছি।
"কামাল আতাতুর্ক নাস্তিকতার যে বিষবা্ষ্প ছড়িয়ে দিয়েছিলো,তা তূরস্ক থেকে মুক্ত হতে আরো বেশ যুগ লেগে যাবে,তবে এরদোগান তার পরিকল্পনায় এগিয়ে আছে বলা যায়।"
আরেকটা জ...... আস্তানা তৈরি হলো।
সারাবিশ্বে শান্তি প্রতিষ্ঠা করা ইসলামের লক্ষ্য
এরদোয়ান এখোন উসমানীয় সম্রাজ্যের দেখানো পথে হাটছে
মন্দির মসজিদ আসলে ভোট ছাড়া আর অন্য কোনো কাজে লাগে কি ।
ভালো উদ্যোগ নেয়া হয়েছে
"নরেন্দ্র মোদী ও অমিত শাহর ঘনিষ্ঠ বলে পরিচিত, সাবেক এক বিজেপি নেতা কয়েক মাস হল আরব সাগরের বুকে এই দ্বীপপুঞ্জের প্রশাসক নিযুক্ত হয়েছেন। দায়িত্ব নেয়ার পরই তিনি এমন কিছু পদক্ষেপ নিয়েছেন, যাতে দ্বীপবাসীরা এখন বাধ্য হয়েছেন 'লাক্ষাদ্বীপ বাঁচানো'র আন্দোল… See more"
আর এতেই বিবিসির চুলকানি উইঠা গেছে।
এরদোয়ান এর পতন হবে নির্মমভাবে।
এক মসজিদ নিয়ে কিছু প্রাণীর পিছে এতো চুলকানি! BBC নিউজ করে এই চুলকানি দেওয়ার জন্য।
CORONIL এর পাবলিক দেয় প্রযুক্তির জ্ঞান
এই প্রতিবেদন দেখলে বুঝা যাচ্ছে বিবিসির গা জলে যাচ্ছে....
বিবিসি ভাম নাস্টিক আর হিন.দুদের গা জালা দেখেছেন এই নিউজে!
মসজিদ নির্মাণ হওয়াতে বি বি সির বুক ফেটে যাচ্ছে।
আলহামদুলিল্লাহ। ধন্যবাদ এরদুগান কে?
"সব শয়তানি পরিকল্পনা তুর্কীরা ধ্বংস করবে ইনশাআল্লাহ, আবারও ওটোমেন খেলাফত আসবে ইনশাআল্লাহ"
"বিবিসির মনে হয় একটু বেশি লাগছে,জলন হচ্ছে খুব"
"এরদোয়ান এখন শুধু তুরষ্কের নেতা নয়,তিনি পুরো মুসলিম বিশ্বের নেতা।"
ধন্যবাদ মুসলিম বিশ্বের প্রভাবশালী নেতা এরদোয়ানকে।
আলহামদুলিল্লাহ
জাযাকাল্লাহ খাইরান
এরদোয়ান
Mithila Tabassum . Tumi ki jano molobadi kare koy.janle aktu boli o
আর সেই ভিক্ষোভ করার জন্য গাদি গাদি ডলার ডালছে আমেরিকা-ইইউ
"ইহুদি / খ্রিষ্টান যায় হোক ক্রুসেডের যুদ্ধ চলতেছে, তাইতো আমেরিকা ইউরোপ ইসরাইল প্রতিষ্ঠা করেছে। বিশ্বের মুসলিম এটা বুঝে না, মুসলিমদের চোখে ধুলো দিয়েছে। দারুন বুদ্ধি করেছে,......."
বর্তমান বিশ্বের শ্রেষ্ঠ মহা নায়ক
তার মানে সেকুলারদের মসজিদেও আপত্তি! এ সেকুলাররা নিজেরাইতো দেখা যাচ্ছে বড় উগ্র মৌলবাদী
চিন হলে পায়খানা উধবোধন হতো।
ধর্মের নামে জনগণকে ধোঁকা দেওয়া খুব সহজ।
মোদী সাম্প্রদায়িক আর এরদোয়ান মুসলিম জাহানের জাগ্রত সুলতান! হিন্দুত্ববাদ হারাম মুসলিমবাদ আরাম! !
যতসব পাগলের কারখানা।
একদিকে মুসলিম মারে আর একদিকে মসজিদ বানায় ছাগু এরাদুয়ান
"এগুলো একটার পর একটা করেই মানুষের মন জগৎকে আচ্ছন্ন করে রেখে,ইউসুফ তৈয়ব রেদওয়ান ক্ষমতা ধরে রাখবে। কিছু দিন আগে খ্রিষ্টানদের হেরিটেজ চার্চ কে মিউজিয়াম থেকে মসজিদ বানিয়েছে । তিনি তুরস্কের বিজেপি ,বজরং নেতা । বাকি কাজের বেলায় ঢঙ ঢঙ । কাগুজে বাঘ । বার্মায় জ… See more"
তুরুস্ক মুসলিম সাম্রাজ্যের রাজধানী। একে ইউরোপীয়রা দখল করে কামাল আতাতুর্ককে ক্ষমতায় বসিয়ে ধর্ম নিরপেক্ষ তকমা দিয়েছিল প্রথম বিশ্ব যুদ্ধের পরে। এক সময় সমস্ত ইউরোপীয়রা সম্মিলিতভাবে যুদ্ধ করেও অটোমানদের সাথে পারতনা। তুরস্কের অটোমানরা আবার জেগে উঠেছে। ইউরোপী… See more
"মাশাল্লা, আরো বেশী করে মসজিদ, মাদ্রাসা খুলে দে।
তবেই তো পায়ের নীচে যাবি যেমন সৌদিসহ বাকি মুছলিম দেশের অবস্থা।"
কিন্তু প্রতিবাদকারীরা সবশেষে মিস্টার এরদোয়ানের কর্তৃত্বপরায়নতাকেই আরও বিস্তৃত হতে দেখলো।
"ভারতে মোদী ক্ষমতায় নাওজুবিল্লা! তুরস্কে এরদোগান, সুবহানাল্লা!"
"অবাক ব্যাপার,ওনার তো দাড়ি নাই। কেউ তো একটা ফতোয়া ঝাড়ল না?বাংলাদেশ তো ফতোয়ার খনি,তার পর ও!"
এটা কি ঢাকা ওয়াসার এমডি তাকসিম সাহেবের সন্মানে তৈরি করা হয়েছে?
আহ মনে হচ্চে পিলার গুলো তাকসিমে গাথা হয় নাই সব কয়টা হাম্বাদিকে পাছায়
মুসলিম রেনেসাঁর নেতা এরদোয়ান! তিনি ওআইসির প্রেসিডেন্ট হওয়ার যোগ্যতা রাখেন!
