"Israel has tried at least 7 times to kill Mohammad Def so far. But every attempt has failed. So many mysteries, so many puzzles surrounding him. How is he living by evading the Israelites?"
"মোহাম্মদ দেফ অসাধারণ মুক্তিযোদ্ধা। বিবিসি এখানে একজনকে বিন লাদেনের মত সাজিয়ে ফিলিস্তিনের নিরীহ মানুষের হত্যার ফোকাস সরিয়ে দিতে চাচ্ছে। দালালি আনলিমিটেড চালিয়ে যাও তোমাদের বাপ দাদা যুক্তরাষ্ট্র, ইসরাইলের পক্ষে।"
"ইনশাআল্লাহ, আল্লাহ এই স্বাধীনতাকামী যোদ্ধাকে রক্ষা করবেন এবং ফিলিস্তিনকে স্বাধীনতা দান করবেন।"
"হামাস কোন উগ্র জঙ্গি সংগঠন নয়, তারা নিজেদের স্বাধীনতার জন্য লড়াই করছে অথচ বিবিসির দালালরা তাদের প্রধানকে চরমপন্থী বলে উল্লেখ্য করে!"
দখলদারদের বিরুদ্ধে স্বাধীনকামী নেতাকে বিবিসি কীভাবে 'চরমপন্থী' বলে?
"একদল সন্ত্রাসী একজন মুক্তিবাহিনিকে খোঁজছে হত্যাকরার জন্য, এখনো তাদেরকে সন্ত্রাসী রাষ্ট্র হিসাবে ঘোষণা দেওয়া হচ্ছে না। বরং তাদেরকে সমর্থন দিয়ে মানবতাবাদীরা নিরীহ ফিলিস্তিনিদের উপর জুলুম চালিয়ে যাচ্ছে !"
"আল্লাহ যাকে বাচাইয়া রাখেন, পৃথিবীর কেউ তাঁকে মারতে পারেনা। ইজরাইল জন্ম অবৈধভাবে ইসরায়েল অবৈধ বাবা বৃটেন। বিবিসি প্রতিষ্ঠান ইজরায়েলের দালাল।"
"ফিলিস্তিনে জঘন্যতম সন্ত্রাসী হামলায় বিবিসিও নৈতিক দায় এড়াতে পারে না। কারণ ইজরায়েলের সন্ত্রাসী কর্মকান্ডে যুক্তরাষ্ট্র, ব্রিটেন এবং আরো শক্তিধর রাষ্ট্র গুলো সরাসরি মমদ দেয় এবং বিবিসির মত গণমাধ্যমগুলো এখানে হলুদ সাংবাদিকতা করে তারাও তাদের সাংবাদিকতা… See more"
"ব্রিটিশ সরকারের অর্থে পরিচালিত বিবিসি হামাস কে জঙ্গি, সন্ত্রাসী বলবে এটাই স্বাভাবিক..."
ব্রিটিশদের কারনেই আজ ফিলিস্তিন ভূখন্ডের এই পরিনতি!!
"এক চোখা হলুদ সংবাদ মাধ্যম ও সাংবাদিকদের চিনতে হবে, কারণ এরা সত্য ও মিথ্যা মিশ্রিত সংবাদ পরিবেশ করে..… See more"
'চরমপন্থী নেতা'?
আপনারা বুদ্ধিপ্রতিবন্ধী সাংবাদিক।
""
BBC ইজরায়েলি হত্যাযজ্ঞকে ফোকাস না করে স্বাধীনতা রক্ষায় নিয়োজিত নেতাকে চরমপন্থী বলে চরম ধৃষ্টতা দেখাচ্ছে।
"বিবিসি'র চোখে মুক্তিযোদ্ধা দেফ যদি 'চরমপন্থী' হয় তবে খুনী নেতানিয়াহু কি নরমপন্থী? আমরা আশ্চর্য হয়ে যাই পশ্চিমা মিডিয়ার ভুমিকায়! ইসরায়েলী দখলদারিত্ব, গনহত্যা ও নির্যাতনের বিরুদ্ধে প্রতিরোধকারী প্রতিরোধ যোদ্ধাদেরকে পশ্চিমা দুনিয়া চরমপন্থী বা জংগী হিসাবে … See more"
He is a great liberation fighter of Palestine. BBC must have lost their shame and consciousness while calling him an extremist.
'চরমপন্থী' নেতা?! বিবিসি বাংলা আমাদের দেশের থার্ড ক্লাস মিডিয়াকেও হার মানায়। অবশ্য জায়োনিস্টদের কাছে এরচে বেশি কিছু আশা করা যায়না।
সন্ত্রাস বাহিনী একজন লোককে হত্যা করার জন্য খুঁজছে অথচ বিবিসি বাংলার শিরোনাম এত সুন্দর যেন লুকোচুরির গল্প শোনাচ্ছে
"পৃথিবীতে যতো তথ্য সন্ত্রাস পরিচালিত হচ্ছে তার অন্যতম প্রধান ভূমিকা পালন করছে BBC News বাংলা, বহু আগেই থেকেই সন্ত্রাসী ইহুদি বাদীদের মদদপুষ্ট পেইড এজেন্ট এই সংবাদ মাধ্যমটি খুব সুচতুর ভাবে সাম্প্রদায়িক উস্কানি, ধর্মীয় সন্ত্রাস সহ ভয়ংকর মিথ্যা ভিত্তিহীন… See more"
ফিলিস্তিনি চরমপন্থী? এসব পক্ষপাত সাংবাদিকতা বাদ দিয়ে রিক্সা চালাও। গত ১১ দিনের হামলায় ফিলিস্তিনের কতগুলো নিরীহ মানুষ হত্যা করেছে ইসরাইল? হামলা বন্ধ হওয়ার পরও ধরপাকড় অত্যাচার কারা করতেছে? সবচেয়ে বড় কথা হলো ফিলিস্তিন ইসরাইলের ভূমি দখল করছে নাকি ইসর… See more
আজকের ফিলিস্তিন-ইসরাইলকে দেখলেই রবীন্দ্রনাথের 'দুইবিঘা জমি' মনে পড়ে।মনে পড়ে উপেনের কথা।
যে উপেন ছিল ভূমির প্রকৃত মালিক তাকেই তাড়িয়ে দেয় জমিদার ।বানায় বাগানবাড়ি ।… See more
"সংবাদ মাধ্যমে হওয়া উচিত নিরাপক্ষ।বিবিসি সে জায়গা থেকে বরাবর ই পক্ষপাত মূলক নিউজ দিয়ে থাকে। মধ্যপ্রাচ্যের একটা মাত্র কিট, সন্ত্রাসী ও দখলদার রাষ্ট্র ইজরায়েল কে তারা দখলদার ও সন্ত্রাসী বলে নাহ।ঠিকি যারা মাতৃভূমি রক্ষার জন্য জীবন বাজি রেখে অধিকার আদায়ের জ… See more"
ফিলিস্তিনি চরমপন্থি!!!!
কত টাকা ইসরাইল থেকে খেয়ে স্বাধীনতাকামি মানুষকে চরমপন্থি বলা হচ্ছে??প্রশ্ন থেকেই গেল বি বি সির কাছে।
বস্তুনিষ্ঠ সংবাদ করতে না পারলে… See more
"আসলে তিনি বেঁচে নেই।সম্ভবত,তিনি বেঁচে আছেন এই ধোঁয়া তুলে ইসরায়েল বেসামরিক এলাকা ধ্বংস করে দখল নিচ্ছে"
কারা জঙ্গি???
ফিলিস্তিনিরা?
হামাস কর্মকর্তারা?… See more
"আল্লাহ প্রদত্ত হায়াত নির্ধারিত,,,যতোদিন হায়াত আছে তাঁকে কেউ হত্যা করতে পারবে না।"
"একজন লোক কে হত্যার উদ্দেশ্য নিয়ে খুজে বেড়াচ্ছে, বিবিসির চোখে সেটা অন্যায় নয়!!?"
"আসলে ভাবতে অবাক লাগে, মাতৃভূমি রক্ষা করা,ও জনগনকে রক্ষা করা কি অন্যায়!!?… See more"
আল্লাহ যাকে বাচিয়ে রাখেন তাঁকে কেউ মারতে পারে না।
"BBC, you can't say Palestine extremists leader.you should have said and reported that every Palestinians , kasmiri are freedom seekers. You and your Western media always doing brokery in favor of Western in the name of democracy. You are playing doub… See more"
"অ-সা-ধা-র-ন মুক্তিযোদ্ধা ""দেফ""।ইজরায়েল কে ঘেন্না করতেও ঘেন্না লাগে।"
"হামাস যদি জংগী হয় তাহলে ইসরাইলের সেনাবাহিনীরা কি? এ তো চোরের মায়ের বড় গলা। সাহস কত চরম্পন্থা, হামাসের জংগী নেতা, ইসরায়েলকে অবৈধ সন্ত্রাসী রাষ্ট্র বলার হেডাম নাই আর মুসলমানদের বলতেছে জংগী,,,,,যাদের নাই কোন ইতিহাস, নাই কোন দলিল, জোর করে দখল করে আছে সন্ত্… See more"
আল্লাহ যদি কাউকে রক্ষা করেন তাহলে পৃথিবীর কোনো শক্তি নাই তাকে মারার।
এ মাসে এক ফিলিস্তিনি চরমপন্থী নেতার পাঠানো একটি অস্পষ্ট অডিও রেকর্ডিং-এ ইসরায়েলকে অশুভ পরিণতির হুঁশিয়ারি দেয়া হয়েছিল।
জানোয়ার সাংবাদিক!… See more
আহ!
"হত্যার এই অপচেষ্টা টা যদি ইসরায়েল না করে আওয়ামিলীগ করতো,তাহলে হয়তোবা প্রথম চেষ্টাতেই সফল হতো।"
"অথবা;বাংলাদেশের হলুদ মিডিয়াগুলো যদি তার পিছু লেগে যেতো, তাহলেও মোহাম্মদ দেফের তেরোটা বেজে যেত।… See more"
"যেভাবে রিপোর্ট করলেন তাতে দেফকে উগ্রবাদী হিসেবে তুলে ধরলেন, অথচ ইসরায়েল এত নিরীহ মানুষ হত্যার পর ও তারপর তারা উগ্রবাদী কিংবা সন্ত্রাসী নয় বাহ হলুদ সাংবাদিকতা.."
মোহাম্মদ দেইফ। অসাধারণ একজন বীর।
একজন বিরোচিত মুক্তিযোদ্ধা মোহাম্মাদ দেফকে নিয়ে বিবিসির বর্ণবাদী আচরণকে ঘৃনাকরি।
অভিষপ্ত দখলদার ইজ'রায়েল অচিরেই ধ্বংস হবে ইনশাআল্লাহ।
বিবিসি বারবারেই ইসরাইলের পাচাটা গোলামীতে ব্যাস্ত। অথচ তারাই মানবতা শান্তি বাকস্বাধীনতার কথা বলে।
এভাবে হত্যাকান্ডে সমর্থন দেওয়ার কোন মানে হয় না।
বিবিসি ইসরায়েলের প্রতিনিধি হয়ে কথা বলছে।
কিছু কিছু সাংবাদিক এর জন্মের ঠিক নাই
বিবিসিকে নিয়ে অনেকে প্রশ্ন তুলছে। আমরা যারা বিবিসিকে নিয়ে প্রশ্ন তুলছি আসলে আমরা নিজেরাই ভুল করছি বিবিসিকে চিনতে। বিবিসি যতই নিরপেক্ষতার পরিচয় দিয়ে থাকুক না কেন তারা কখনোই নিরপেক্ষ সংবাদ পরিবেশন করতে পারে না।তাদের অনেক সীমাবদ্ধতা আছে।
"একজন মুক্তিকামী মানুষকে বেআইনিভাবে হত্যা করার জন্য খুজছে, এটা ইসরায়েলের জঘন্য মানবতাবিরোধী কাজ। এজন্য তো জাতিসংঘ থেকে ইসরায়েলকে সন্ত্রাসী রাষ্ট্র ঘোষণা করা দরকার এখনই। ইসরায়েলকে কেন জাতিসংঘ সন্ত্রাসী রাষ্ট্র ঘোষণা করছে না সে ব্যাপারে বিবিসির রিপোর্ট চা… See more"
তাকে খুঁজে না পাওয়াটা রহস্যজনক!ইসরায়েল যেখানে ইরানের রেভুলোশনারি গার্ডের প্রধানকে খুঁজে হত্যা করতে পেরেছে সেখানে ওনাকে বের করা তাদের জন্য মামুলী ব্যাপার মনে হচ্ছে। হতে পারে ইজরায়েল তাকে আপাতত খোঁজার চেষ্টা করছে না অথবা হামাসের প্রধানের সাথে তাদের আঁতাত… See more
বিবিসিও যে দালাল মিডিয়া আজ ১০০% নিশ্চিত হলাম।যারা দেশ রক্ষায় মুক্তিযুদ্ধ করে তারা এদের কাছে জঙ্গি।হায়রে মিডিয়া
"""বিবিসির"" ফিলিস্তিনি নেতাকে চরমপন্থী হিসেবে উল্লেখ করা প্রকারান্তরে পক্ষপাতদুষ্ট আচরণেরই বহিঃপ্রকাশ ..."
"আরে ভাই আফগানিস্তানে লাদেন আছে বলে লাখ লাখ নিরিহ মানুষকে হত্যা করেছে আমেরিকা ,, ইরাকে রাসায়নিক বোমা আছে বলে আজ ইরাক শেষ,, হামাসের সাময়িক প্রধান আছে বলে বলে শুধু হামলা করে ,, তার মানে হামলা করতে করতে ফিলিস্তিনি সব মেরে ফেলবে,, শুধু ইসরাইল আমেরিকা না আ… See more"
"মারা গেছে অনেক আগে, ইসরায়েলের টার্গেট মিস হয় না"
BBC News বাংলা'য় পড়ে যেটা বুঝলাম
যে টেরোরিস্ট কান্ট্রি ইসরাইলের পক্ষ নিয়ে গল্প সাজিয়েছেন এবং ফিলিস্তিনদের গল্প তালিকায় রেখেছেন দোষের তকমা অথচ
"""বিবিসি বাংলা "" প্রমাণ করেন যে… See more"
ইজরায়েল একটা টেরোরিস্ট স্ট্যাট
ইজরায়েলর প্রত্যেক সামরিক বাহিনী হচ্ছে আজকের যুগের নিকৃষ্ট জঙ্গী।
"ইজরায়েল জঙ্গী,ইজরায়েল উগ্রবাদী,ইজরায়েল চরমপন্থী … See more"
"এত প্রযুক্তি থাকার পরেও ইসরাইল হামাসের কাছে ব্যার্থ, এটাই বাস্তব সত্য, সত্যের কাছে মিথ্যা পরাজিত"
"মাতৃভূমির জন্য, ছিনিয়ে নেয়া অধিকার আদায়ের জন্য অবৈধ ইসরাইলি আগ্রাসনের বিপক্ষে যুদ্ধ করা একজন বীরকে বিবিসি বলছে `একজন ফিলিস্তিনি চরমপন্থী নেতা!' যেনো সন্ত্রাসী ইসরাইলের নেতা নেতানিয়াহুর মুখেই কথা বলছে বিবিসি! কী আশ্চর্য!"
সীমাহীণ ঘৃণা বিবিসি'র প্রতি।
"এই সংবাদ রিপোর্ট যে সাংবাদিক লিখছে,লেখার স্টাইল দেখেই বুঝা যাচ্ছে যে সে নিজেও চরমপন্থি ইহুদীদের দালাল।"
আমার প্রশ্ন হচ্ছে ইজরাইল কি কোনো বৈধ রাষ্ট্র? আপনারা যখন সংবাদ পরিবেশন করেন তখন ইজরাইল কে অবৈধ রাষ্ট্র বা সন্ত্রাসী রাষ্ট্র বলেন না কেন? যারা দেফ কে মারার জন্য বারবার চেষ্টা করছে তাদের জঙ্গি না বলে উল্টো দেফকেই বলছেন চরমপন্থি!
"সংবাদের উপস্থাপনাটা এমন, যেন দুনিয়াবাসি তাকে হত্যা করা জন্য ইসরায়েলকে দ্বায়িত্ব দিয়েছে?"
আল্লাহ্‌ তাকে রক্ষা করুক আর ধংস হোক সেই সব পাপী শয়তানরা যারা অসহায় নিরীহ মানুষদের উপর অন্যায় ভাবে অত্যাচার করছে।
"রাখে আল্লাহ মারে কে
আর জীবন ভর মুসলিম দের কে আপনারা চরমপন্থী বলেই যাবেন। মুসলিম রা যদি প্রথম থেকে এর প্রতিবাদ করে যেত, তাহলে হয়তো এই বাক্য টা অনেক আগেই পৃথিবী থেকে র্নিমূল হতো।"
The only reason is they live for the country and they die for the country. They love their people and they want their people to have good and comfortable safe life.
আমাদের এলাকায় কেউ কুটিল টাইপের হলে তাদের 'ব্রিটিশ' বলে গালি দেয়া হয়। এক সময় সারা পৃথিবীতে এরা অশান্তি সৃষ্টি করে গিয়েছে আর এখন এদের নিউজ এজেন্সি হলুদ সাংবাদিকতা দিয়ে অশান্তি সৃষ্টি করছে। এরা প্রজন্ম থেকে প্রজন্ম ভাল মানুষের মুখোশধারী শয়তানই থেকে যাবে। … See more
"বিবিসির উদ্দেশ্য বুঝতে পারার জন্য সকলকে ধন্যবাদ।এভাবেই সকল মুসলিমদের উচিৎ এসব দালাল মিডিয়া থেকে হেফাজতে থাকা।কিভাবে তারা একজন মুক্তিযোদ্ধা কে কথিত ""চরমপন্থী/জঙ্গি"" হিসেবে উপস্থাপন করতে চাই।ধিক্কার এসব নিরপেক্ষ নামের দালাল হলুদ মিডিয়াকে।"
"He is not a terrorist, he is the commander of freedom fighters. So BBC, you should broadcast neutral news."
মুক্তিকামী মানুষ প্রতিরোধ করতে চাইলেই 'চরমপন্থী'?
© Yeanur Rahman.
এইসব নিউজগুলোর পিছনে একটা শয়তানি উদ্দেশ্য লুকিয়ে থাকে। হামাসের শতাধিক সদস্যকে হত্যার পর হামাসেরই এক সদস্যকে সুপারহিউম্যান সাজিয়ে ইসরায়েলি হত্যাকান্ডকে বিস্মৃতির দিকে ঠেলে দেওয়া। … See more
মোহাম্মদ দেফ চরমপন্থী আর ইসরাইল কি উদারপন্থী!! বিবিসি আসলে তাদেরই সন্তান! কখনোই পিতার বিরুদ্ধে কিছু বলেনা!
কিসের চরমপন্থী?মাতৃভূমি রক্ষার জন্য যুদ্ধ করছে। বরং ইসরাইল হচ্ছে জংগী দেশ।বিবিসির নিউজটা এক পক্ষে গেল।
আর কিভাবে ফাকি দিতে পেরেছে সে জন্য বিবিসির মাথা নষ্ট হয়ে গেছে। দালাল মিডিয়া।।সে জন্য অনেক আগেই বিবিসি শোনা বন্ধ করে দিয়েছি।।
আল্লাহ্‌ তাকে রক্ষা করুক আর ধংস হোক সেই সব পাপী শয়তানরা যারা অসহায় নিরীহ মানুষদের উপর অন্যায় ভাবে অত্যাচার করছে।
বিবিসির এই প্রতিবেদনে স্পষ্ট করে বলা হয়েছে মোবাইল কম্পিউটার ব্যাবহার না করার কারনে জনাব দেফ কে মারা যাচ্ছে না তা হলে বুঝতে পারছেন? আমরা ইমেইল ফেসবুক এর মাধ্যমে নিজেরাই আমাদের সমস্ত ডাটা দিচ্ছি শত্রুকে আনরা কি করছি কোথায় যাচ্ছি সব ট্রেক করা যাবে আমার হা… See more
"A freedom fighter can never be a terrorist. West is supporting Israel in a blind eye. They are trying to label fight for the freedom as a terrorist act. Hamas leaders are not terrorist , they have every aspects of rights to protect their country and th… See more"
"আমি এসে গেছি , যার আসার কথা ছিলো , আমি সেই জন যার কথা তোমরা আগে থেকেই জানো । আমার সময় উপস্তিত , আমাকে বিশ্বাস করো তোমার । আমি তোমাদের রক্ষা র্কতা . আমাকেই ঠিক করা হয়েছে তোমাদের রক্ষা কররা জন্যে । আমাকে বিশ্বাস করো তোমারা , আমার পথে এসো তোমরা ।আমার পথ স… See more"
নিউজটা অজপাড়াগাঁয়ের সাইকেল রিপোর্টার ঝন্টুর মতই হয়েছে। সেই ঝন্টুরাই এখন বড় রিপোর্টার। তাই চাইলেও সাহস করে দালালির উর্দ্ধে গিয়ে আন্তর্জাতিক মন রক্ষা সম্ভব নয়।
